Artist,Title,Medium,Medium_classified,Acquistion_classified,Year_acquisition,Gender_classified,Artist_birth_year,Artist_death_year,Country_calculated,Date_creation_year
Francisco Durrio (Francisco José Durrieu de Madron),Rostro de perfil (Sortija) (Side View of Face [Ring]),,object,,2017,,1868,1940,,1895
Francisco Durrio (Francisco José Durrieu de Madron),Cleopatra (Ring),,object,,2017,,1868,1940,,1895
Francisco Durrio (Francisco José Durrieu de Madron),Muerte de Cleopatra (Sortija) (Death of Cleopatra [Ring]),,object,,2017,,1868,1940,,1895
Matías Duville,Dos piedras (Two Stones),,painting,,2018,,1974,,Argentina,2008
EAE: Euskal Artisten Elkartea (Asociación de Artistas Vascos),"Acción ""El Museo"" (Action ""The Museum"")",,video art,,2013,,1983,,Spain,1983
Juan de Echevarría,Marinero (Sailor),,painting,,1988,,1875,1931,Spain,1910
Juan de Echevarría,Florero (Flower Vase),,painting,,1988,,1875,1931,Spain,1912
Juan de Echevarría,Granada desde el Albaicín (Granada from the Albaicin),,painting,,1988,,1875,1931,Spain,1914
Juan de Echevarría,Montmartre,,painting,,1988,,1875,1931,Spain,1914
Juan de Echevarría,Ávila,,painting,,1988,,1875,1931,Spain,1917
Juan de Echevarría,"Luis García Bilbao, poeta (Luis García Bilbao, Poet)",,painting,,1988,,1875,1931,Spain,1918
Juan de Echevarría,Merienda vasca en Ondárroa (Basque Picnic in Ondárroa),,painting,,1988,,1875,1931,Spain,1918
Juan de Echevarría,Retrato de Iturrino (Portrait of Iturrino),,painting,,1988,,1875,1931,Spain,1919
Juan de Echevarría,Naturaleza muerta (Still Life),,painting,,1988,,1875,1931,Spain,1920
Juan de Echevarría,Pío Baroja,,painting,,1988,,1875,1931,Spain,1920
Juan de Echevarría,Pampliega,,painting,,1988,,1875,1931,Spain,1920
Juan de Echevarría,Azorín,,painting,,1988,,1875,1931,Spain,1922
Juan de Echevarría,Ramón del Valle-Inclán,,painting,,1988,,1875,1931,Spain,1922
Juan de Echevarría,Retrato de Juanito Negrín (Portrait of Juanito Negrín),,painting,,1988,,1875,1931,Spain,1923
Juan de Echevarría,Mestiza desnuda (Mixed-Race Nude),,painting,,1988,,1875,1931,Spain,1923
Juan de Echevarría,Paco Durrio,,painting,,1988,,1875,1931,Spain,1924
Juan de Echevarría,Familia gitana (Gypsy Family),,painting,,1988,,1875,1931,Spain,1925
Juan de Echevarría,Puente de Ondárroa (Ondárroa Bridge),,painting,,1988,,1875,1931,Spain,1925
Juan de Echevarría,Paisaje (Landscape),,painting,,1988,,1875,1931,Spain,1925
Juan de Echevarría,Unamuno,,painting,,1988,,1875,1931,Spain,1930
Juan de Echevarría,Retrato de Unamuno de pie (Portrait of Unamuno Standing),,painting,,1988,,1875,1931,Spain,1930
Harold E. Edgerton,Diver,,photography,,2003,,1903,1990,United States,1930
Harold E. Edgerton,Diver Underwater,,photography,,2003,,1903,1990,United States,1940
Harold E. Edgerton,Acrobats,,photography,,2003,,1903,1990,United States,1941
Viking Eggeling,Symphonie Diagonale (Diagonal Symphony),,video art,,2008,,1880,1925,Germany,1921
William Eggleston,Untitled,,photography,,2003,,1939,,United States,1971
Felipe Ehrenberg,La caída (The Fall),,painting,,2016,,1943,2017,Mexico,1968
Felipe Ehrenberg,"La Poubelle, or It's a Sort of Disease II",,video art,,2016,,1943,2017,Mexico,1970
Felipe Ehrenberg,"La Poubelle. Si os dan papel pautado, escribid por el otro lado (La Poubelle. If They Give You Ruled Paper, Write on the Other Side)",,graphics,,2016,,1943,2017,Mexico,2016
Felipe Ehrenberg,"La Poubelle. El presente siempre cambia el pasado, pero el pasado siempre cambia el presente (La Poubelle. The Present Always Changes the Past, But the Past Always Changes the Present)",,graphics,,2016,,1943,2017,Mexico,2016
Hélio Eichbauer,"Projeto cenográfico, 2º e 3º ato: O Rei da Vela (Scenographic Project, 2nd and 3rd Act: The Candle King)",,graphics,,,,2018,,Brazil,1967
Jerónimo Elespe,O,,painting,,2015,,1975,,Spain,2009
Jerónimo Elespe,M.H,,painting,,2015,,1975,,Spain,2009
Jerónimo Elespe,Midnight Gardening,,painting,,2015,,1975,,Spain,2011
Jerónimo Elespe,Ruined Diary 10,,graphics,,2015,,1975,,Spain,2012
Jerónimo Elespe,Ruined Diary 17,,graphics,,2015,,1975,,Spain,2012
Jerónimo Elespe,Ruined Diary 8,,graphics,,2015,,1975,,Spain,2012
Jerónimo Elespe,Ruined Diary 14,,graphics,,2015,,1975,,Spain,2012
Jerónimo Elespe,Casuals,,painting,,2015,,1975,,Spain,2013
Jerónimo Elespe,R.F,,painting,,2015,,1975,,Spain,2014
Jerónimo Elespe,Paseos de lexicógrafo 2 (Lexicographer's Wanderings 2),,painting,,2015,,1975,,Spain,2014
Olafur Eliasson,We Only Meet When We Move,,installation,,2007,,1967,,Denmark,2004
Concha Elorza,Santa Casilda. Seeing My Own Death,,photography,,2009,,1961,,Spain,1989
Diamela Eltit,Zona de Dolor I (Pain Zone I),,installation,,2011,,1949,,,1980
Enric Planasdurà (Enric Planas Durà),Composición (Composition),,painting,,1988,,1921,1984,Spain,1956
Equipo 57,Interactividad Cine I (A-11) (Interactivity Film I [A-11]),,graphics,,1997,,1957,1962,,1957
Equipo 57,Interactividad Cine I (A-18) (Interactivity Film I [A-18]),,graphics,,1997,,1957,1962,,1957
Equipo 57,Interactividad Cine I (C-26) (Interactivity Film I [C-26]),,graphics,,1997,,1957,1962,,1957
Equipo 57,Interactividad Cine I (C-53) (Interactivity Film I [C-53]),,graphics,,1997,,1957,1962,,1957
Equipo 57,Interactividad Cine I (C-60) (Interactivity Film I [C-60]),,graphics,,1997,,1957,1962,,1957
Equipo 57,Interactividad Cine I (C-70) (Interactivity Film I [C-70]),,graphics,,1997,,1957,1962,,1957
Equipo 57,Interactividad Cine I (C-82) (Interactivity Film I [C-82]),,graphics,,1997,,1957,1962,,1957
Equipo 57,Interactividad Cine I (D-7) (Interactivity Film I [D-7]),,graphics,,1997,,1957,1962,,1957
Equipo 57,Interactividad Cine I (D-25) (Interactivity Film I [D-25]),,graphics,,1997,,1957,1962,,1957
Equipo 57,Interactividad Cine I (D-43) (Interactivity Film I [D-43]),,graphics,,1997,,1957,1962,,1957
Equipo 57,Interactividad Cine I (D-86) (Interactivity Film I [D-86]),,graphics,,1997,,1957,1962,,1957
Equipo 57,Interactividad Cine I (D-105) (Interactivity Film I [D-105]),,graphics,,1997,,1957,1962,,1957
Equipo 57,Interactividad Cine I (D-106) (Interactivity Film I [D-106]),,graphics,,1997,,1957,1962,,1957
Equipo 57,Interactividad Cine I (D-126) (Interactivity Film I [D-126]),,graphics,,1997,,1957,1962,,1957
Equipo 57,Interactividad Cine I (D-127) (Interactivity Film I [D-127]),,graphics,,1997,,1957,1962,,1957
Equipo 57,Interactividad Cine I (D-132) (Interactivity Film I [D-132]),,graphics,,1997,,1957,1962,,1957
Equipo 57,Interactividad Cine I (D-133) (Interactivity Film I [D-133]),,graphics,,1997,,1957,1962,,1957
Equipo 57,Interactividad Cine I (E-58) (Interactivity Film I [E-58]),,graphics,,1997,,1957,1962,,1957
Equipo 57,Interactividad Cine I (E-85) (Interactivity Film I [E-85]),,graphics,,1997,,1957,1962,,1957
Equipo 57,Interactividad Cine I (E-104) (Interactivity Film I [E-104]),,graphics,,1997,,1957,1962,,1957
Equipo 57,Interactividad Cine I (E-106) (Interactivity Film I [E-106]),,graphics,,1997,,1957,1962,,1957
Equipo 57,Film experiencia n.º 1. Base teórica: interactividad del espacio plástico (Film Experience No. 1. Theoretical Foundation: Interactivity of Plastic Space),,video art,,2010,,1957,1962,,1957
Equipo 57,Interactividad Cine I (B-34) (Interactivity Film I [B-34]),,graphics,,1997,,1957,1962,,1957
Equipo 57,Interactividad Cine I (C-3) (Interactivity Film I [C-3]),,graphics,,1997,,1957,1962,,1957
Equipo 57,Interactividad Cine I (C-8) (Interactivity Film I [C-8]),,graphics,,1997,,1957,1962,,1957
Equipo 57,Interactividad Cine I (C-13) (Interactivity Film I [C-13]),,graphics,,1997,,1957,1962,,1957
Equipo 57,Interactividad Cine I (C-63) (Interactivity Film I [C-63]),,graphics,,1997,,1957,1962,,1957
Equipo 57,Interactividad Cine I (C-78) (Interactivity Film I [C-78]),,graphics,,1997,,1957,1962,,1957
Equipo 57,Interactividad Cine I (D-111) (Interactivity Film I [D-111]),,graphics,,1997,,1957,1962,,1957
Equipo 57,Interactividad Cine I (D-116) (Interactivity Film I [D-116]),,graphics,,1997,,1957,1962,,1957
Equipo 57,Interactividad Cine I (E-16) (Interactivity Film I [E-16]),,graphics,,1997,,1957,1962,,1957
Equipo 57,Interactividad Cine I (E-23) (Interactivity Film I [E-23]),,graphics,,1997,,1957,1962,,1957
Equipo 57,Interactividad Cine I (E-78) (Interactivity Film I [E-78]),,graphics,,1997,,1957,1962,,1957
Equipo 57,Interactividad Cine I (A-3) (Interactivity Film I [A-3]),,graphics,,1997,,1957,1962,,1957
Equipo 57,Interactividad Cine I (A-8) (Interactivity Film I [A-8]),,graphics,,1997,,1957,1962,,1957
Equipo 57,Interactividad Cine I (A-19) (Interactivity Film I [A-19]),,graphics,,1997,,1957,1962,,1957
Equipo 57,Interactividad Cine I (Interactivity Film I),,graphics,,1997,,1957,1962,,1957
Equipo 57,Interactividad Cine I (B-1) (Interactivity Film I [B-1]),,graphics,,1997,,1957,1962,,1957
Equipo 57,Interactividad Cine I (B-11) (Interactivity Film I [B-11]),,graphics,,1997,,1957,1962,,1957
Equipo 57,Interactividad Cine I (B-12) (Interactivity Film I [B-12]),,graphics,,1997,,1957,1962,,1957
Equipo 57,Interactividad Cine I (B-18) (Interactivity Film I [B-18]),,graphics,,1997,,1957,1962,,1957
Equipo 57,Interactividad Cine I (B-24) (Interactivity Film I [B-24]),,graphics,,1997,,1957,1962,,1957
Equipo 57,Interactividad Cine I (B-32) (Interactivity Film I [B-32]),,graphics,,1997,,1957,1962,,1957
Equipo 57,Interactividad Cine I (B-49) (Interactivity Film I [B-49]),,graphics,,1997,,1957,1962,,1957
Equipo 57,Interactividad Cine I (C-4) (Interactivity Film I [C-4]),,graphics,,1997,,1957,1962,,1957
Equipo 57,Interactividad Cine I (C-22) (Interactivity Film I [C-22]),,graphics,,1997,,1957,1962,,1957
Equipo 57,Interactividad Cine I (D-3) (Interactivity Film I [D-3]),,graphics,,1997,,1957,1962,,1957
Equipo 57,Interactividad Cine I (D-63) (Interactivity Film I [D-63]),,graphics,,1997,,1957,1962,,1957
Equipo 57,Interactividad Cine I (D-79) (Interactivity Film I [D-79]),,graphics,,1997,,1957,1962,,1957
Equipo 57,Interactividad Cine I (D-95) (Interactivity Film I [D-95]),,graphics,,1997,,1957,1962,,1957
Equipo 57,Interactividad Cine I (D-109) (Interactivity Film I [D-109]),,graphics,,1997,,1957,1962,,1957
Equipo 57,Interactividad Cine I (D-112) (Interactivity Film I [D-112]),,graphics,,1997,,1957,1962,,1957
Equipo 57,Interactividad Cine I (D-118) (Interactivity Film I [D-118]),,graphics,,1997,,1957,1962,,1957
Equipo 57,Interactividad Cine I (E-6) (Interactivity Film I [E-6]),,graphics,,1997,,1957,1962,,1957
Equipo 57,Interactividad Cine I (E-42) (Interactivity Film I [E-42]),,graphics,,1997,,1957,1962,,1957
Equipo 57,Interactividad Cine I (E-45) (Interactivity Film I [E-45]),,graphics,,1997,,1957,1962,,1957
Equipo 57,Interactividad Cine I (E-51) (Interactivity Film I [E-51]),,graphics,,1997,,1957,1962,,1957
Equipo 57,Interactividad Cine I (E-55) (Interactivity Film I [E-55]),,graphics,,1997,,1957,1962,,1957
Equipo 57,Interactividad Cine I (E-57) (Interactivity Film I [E-57]),,graphics,,1997,,1957,1962,,1957
Equipo 57,Interactividad Cine I (E-76) (Interactivity Film I [E-76]),,graphics,,1997,,1957,1962,,1957
Equipo 57,Interactividad Cine I (E-81) (Interactivity Film I [E-81]),,graphics,,1997,,1957,1962,,1957
Equipo 57,Sin título (Untitled),,sculpture,,2009,,1957,1962,,1959
Equipo 57,Composición (Composition),,painting,,1988,,1957,1962,,1959
Equipo 57,P. A. 20,,painting,,1989,,1957,1962,,1959
Equipo 57,Sin título. Conjunto de prototipos y maquetas (Untitled. Set of Prototypes and Mockups),,sculpture,,2013,,1957,1962,,1959
Equipo 57,Sin título. Conjunto de prototipos y maquetas (Untitled. Set of Prototypes and Mockups),,sculpture,,2013,,1957,1962,,1959
Equipo 57,Sin título. Conjunto de prototipos y maquetas (Untitled. Set of Prototypes and Mockups),,sculpture,,2013,,1957,1962,,1959
Equipo 57,Sin título. Conjunto de prototipos y maquetas (Untitled. Set of Prototypes and Mockups),,sculpture,,2013,,1957,1962,,1959
Equipo 57,Sin título. Conjunto de prototipos y maquetas (Untitled. Set of Prototypes and Mockups),,sculpture,,2013,,1957,1962,,1959
Equipo 57,Sin título. Conjunto de prototipos y maquetas (Untitled. Set of Prototypes and Mockups),,sculpture,,2013,,1957,1962,,1959
Equipo 57,Tríptico (Triptych),,painting,,1988,,1957,1962,,1960
Equipo 57,Sin título. Conjunto de prototipos y maquetas (Untitled. Set of Prototypes and Mockups),,sculpture,,2013,,1957,1962,,1960
Equipo 57,Sin título. Conjunto de prototipos y maquetas (Untitled. Set of Prototypes and Mockups),,sculpture,,2013,,1957,1962,,1960
Equipo 57,Sin título. Conjunto de prototipos y maquetas (Untitled. Set of Prototypes and Mockups),,sculpture,,2013,,1957,1962,,1960
Equipo 57,Sin título. Conjunto de prototipos y maquetas (Untitled. Set of Prototypes and Mockups),,sculpture,,2013,,1957,1962,,1960
Equipo 57,Sin título. Conjunto de prototipos y maquetas (Untitled. Set of Prototypes and Mockups),,sculpture,,2013,,1957,1962,,1961
Equipo 57,Sin título (Untitled),,sculpture,,2013,,1957,1962,,1961
Equipo 57,Sin título. Conjunto de prototipos y maquetas (Untitled. Set of Prototypes and Mockups),,sculpture,,2013,,1957,1962,,1961
Equipo 57,Silla Erlo (Erlo Chair),,,,2013,,1957,1962,,1961
Equipo 57,Sin título. Conjunto de prototipos y maquetas (Untitled. Set of Prototypes and Mockups),,sculpture,,2013,,1957,1962,,1962
Equipo 57,Sin título. Conjunto de prototipos y maquetas (Untitled. Set of Prototypes and Mockups),,sculpture,,2013,,1957,1962,,1962
Equipo 57,Sin título. Conjunto de prototipos y maquetas (Untitled. Set of Prototypes and Mockups),,sculpture,,2013,,1957,1962,,1962
Equipo 57,Sin título. Conjunto de prototipos y maquetas (Untitled. Set of Prototypes and Mockups),,sculpture,,2013,,1957,1962,,1962
Equipo 57,Sin título. Conjunto de prototipos y maquetas (Untitled. Set of Prototypes and Mockups),,sculpture,,2013,,1957,1962,,1962
Equipo 57,Sin título. Conjunto de prototipos y maquetas (Untitled. Set of Prototypes and Mockups),,sculpture,,2013,,1957,1962,,1962
Equipo Crónica,Alta sociedad (High Society),,painting,,2012,,1964,1981,Spain,1966
Equipo Crónica,Deformación profesional (Professional Deformation),,painting,,1999,,1964,1981,Spain,1966
Equipo Crónica,Barroco español (Spanish Baroque),,graphics,,1999,,1964,1981,Spain,1966
Equipo Crónica,Condecoraciones (Decorations),,graphics,,2010,,1964,1981,Spain,1966
Equipo Crónica,La cultura de Occidente (Western Culture),,graphics,,1999,,1964,1981,Spain,1968
Equipo Crónica,El realismo socialista y el Pop Art en el campo de batalla (Socialist Realism and Pop Art in the Battle Field),,painting,,2010,,1964,1981,Spain,1969
Equipo Crónica,Pintar es como golpear (Painting is Like Hitting),,painting,,1997,,1964,1981,Spain,1972
Equipo Crónica,La derrota de Samotracia (The Defeat of Samothrace),,painting,,1997,,1964,1981,Spain,1972
Equipo Crónica,La comida (The Meal),,painting,,2005,,1964,1981,Spain,1972
Equipo Crónica,Espectador de espectadores (Spectator of Spectators),,sculpture,,2009,,1964,1981,Spain,1972
Equipo Crónica,Espectador de espectadores (Spectator of Spectators),,sculpture,,2015,,1964,1981,Spain,1972
Equipo Crónica,Guernica cortado (Guernica Cut Up),,painting,,1997,,1964,1981,Spain,1974
Equipo Crónica,Las peñas (The Clubs),,painting,,1997,,1964,1981,Spain,1975
Equipo Crónica,Paredón II (Wall II),,painting,,2000,,1964,1981,Spain,1975
Equipo Crónica,Orden de operaciones (Order of Operations),,painting,,2000,,1964,1981,Spain,1976
Equipo Crónica,Pinturas Colón (Colón Paints),,sculpture,,1997,,1964,1981,Spain,1977
Equipo Crónica,Pupitre (Desk),,sculpture,,1998,,1964,1981,Spain,1977
Equipo Crónica,Interior con traje nuevo II (Interior with New Suit II),,painting,,1988,,1964,1981,Spain,1980
Equipo Crónica,Interior con traje nuevo I (Interior with New Suit I),,painting,,1988,,1964,1981,Spain,1980
Equipo Crónica,Mr. Cézanne en el carrer Avinyó (Mr. Cézanne on Avinyó Street),,painting,,1988,,1964,1981,Spain,1980
Equipo Crónica,El viejo exiliado II (The Old Exile II),,painting,,1995,,1964,1981,Spain,1980
Equipo Realidad,La divina proporción (Divine Proportion),,painting,,2006,,1966,1976,Spain,1967
Equipo Realidad,"Manolas y toreros (""Manolas"" and Bullfighters)",,graphics,,2010,,1966,1976,Spain,1967
Equipo Realidad,86 misses en traje de baño (86 Beauty Contestants in Swimwear),,painting,,2006,,1966,1976,Spain,1968
Max Ernst,Oiseaux rouges (Red Birds),,painting,,1990,,1891,1976,,1926
Max Ernst,La belle allemande (The Beautiful German Woman),,sculpture,,1995,,1891,1976,,1934
Paz Errázuriz,Evelyn. La Manzana de Adán (Evelyn. Adam's Apple),,photography,,1987,,1944,,,1982
Paz Errázuriz,Mujer (Woman),,photography,,1987,,1944,,,1983
Paz Errázuriz,Miss Piggy,,photography,,1987,,1944,,,1984
Paz Errázuriz,Malabaristas (Jugglers),,photography,,1987,,1944,,,1984
Paz Errázuriz,Evelyn. La Manzana de Adán (Evelyn. Adam's Apple),,photography,,1987,,1944,,,1984
Paz Errázuriz,Bar La Sirena. Chiloé (La Sirena Bar. Chiloé),,photography,,1987,,1944,,,1984
Paz Errázuriz,"Cementerio General, Santiago (General Cemetery, Santiago)",,photography,,1987,,1944,,,1985
Paz Errázuriz,La manzana de Adán (Adam's Apple),,photography,,2019,,1944,,,1990
Erró (Gudmundur Gudmundsson),Les vainqueurs de Leningrad supportés par le monstre daltonien Matisse (The Victors of Leningrad supported by the Colour-Blind Monster Matisse),,painting,,2010,,1932,,Iceland,1966
Elliott Erwitt,North Carolina,,photography,,2003,,1928,,,1950
Elliott Erwitt,"Valencia, Spain",,photography,,2003,,1928,,,1952
Elliott Erwitt,Provence,,photography,,2003,,1928,,,1955
Elliott Erwitt,"Madrid, Museo del Prado",,photography,,2003,,1928,,,1995
Pepe Espaliú,Santos V (Saints V),,sculpture,,1997,,1955,1993,Spain,1988
Pepe Espaliú,Santos IV (Saints IV),,sculpture,,1997,,1955,1993,Spain,1988
Pepe Espaliú,Santos VII (Saints VII),,sculpture,,1997,,1955,1993,Spain,1988
Pepe Espaliú,Santos X (Saints X),,sculpture,,1995,,1955,1993,Spain,1988
Pepe Espaliú,Sin título (Untitled),,sculpture,,1995,,1955,1993,Spain,1990
Pepe Espaliú,Carrying XI,,sculpture,,1997,,1955,1993,Spain,1992
Pepe Espaliú,Sin título (Tres jaulas) (Untitled [Three Cages]),,sculpture,,1995,,1955,1993,Spain,1992
Pepe Espaliú,Sin título (Untitled),,graphics,,2007,,1955,1993,Spain,1993
Pepe Espaliú,Sin título (Untitled),,graphics,,2007,,1955,1993,Spain,1993
Pepe Espaliú,Sin título (Untitled),,graphics,,2007,,1955,1993,Spain,1993
Pepe Espaliú,Sin título (Untitled),,graphics,,2007,,1955,1993,Spain,1993
Pepe Espaliú,Sin título (Untitled),,graphics,,2007,,1955,1993,Spain,1993
Pepe Espaliú,Sin título (Untitled),,graphics,,2007,,1955,1993,Spain,1993
Pepe Espaliú,Sin título (Untitled),,graphics,,2007,,1955,1993,Spain,1993
Pepe Espaliú,Sin título (Untitled),,graphics,,2007,,1955,1993,Spain,1993
Pepe Espaliú,Sin título (Untitled),,graphics,,2007,,1955,1993,Spain,1993
Pepe Espaliú,Sin título (Untitled),,graphics,,2007,,1955,1993,Spain,1993
José Espert Arcos,Escuela Provincial de Puericultura de Valencia (The Provincial Childcare School of Valencia),,graphics,,2009,,1907,1951,Mexico,1931
Patricia Esquivias,Folklore #1,,video art,,2008,,1979,,Venezuela,2006
Patricia Esquivias,Natures at the Hand,,video art,,2018,,1979,,Venezuela,2006
Patricia Esquivias,Folklore #2,,video art,,2008,,1979,,Venezuela,2008
Patricia Esquivias,Folklore #4,,video art,,2009,,1979,,Venezuela,2009
Patricia Esquivias,Folklore #3,,video art,,2018,,1979,,Venezuela,2010
Patricia Esquivias,Murales de cerámica realizados por Manuel S. Molezún y Amadeo Gabino en 1958 (Ceramic Murals Made by Manuel S. Molezún and Amadeo Gabino in 1958),,photography,,2018,,1979,,Venezuela,2013
Patricia Esquivias,El pueblo español tiene un camino que conduce a una estrella (The Spanish People Have a Path that Leads to a Star),,installation,,2018,,1979,,Venezuela,2013
Patricia Esquivias,111-119 Generalísimo/Castellana,,video art,,2018,,1979,,Venezuela,2014
Barbara Ess,Untitled,,photography,,2003,,1948,,United States,1984
Estampa Popular de Madrid,Miguel Hernández. Estampa Popular de Madrid,,graphics,,2010,,1959,1981,Spain,1969
Estampa Popular de Valencia,Cartel de Estampa Popular de Valencia (A Poster by Estampa Popular Valencia),,graphics,,2011,,1964,1968,Spain,1964
Estampa Popular de Valencia,Hoja volandera de Estampa Popular de Valencia (Flyer from Estampa Popular Valencia),,graphics,,2011,,1964,1968,Spain,1964
Estampa Popular de Valencia,Homenatge a Antonio Machado (Homage to Antonio Machado). Sevilla 1875 - Coillure 1939. Estampa popular de Valencia,,graphics,,2011,,1964,1968,Spain,1965
Estampa Popular de Valencia,Esta es su vida. El mundo en que vivimos. 1965 (This Is Your Life. The World We Live In. 1965),,graphics,,2010,,1964,1968,Spain,1965
Estampa Popular de Valencia,Mirant València (Looking at Valencia),,graphics,,2011,,1964,1968,Spain,1966
Estampa Popular de Valencia,"Cartelera Turia, n.º 145",,graphics,,2018,,1964,1968,Spain,1966
Estampa Popular,Cartel de la exposición «Grabados de Estampa Popular». Club Pueblo (Exhibition Poster “Estampa Popular Prints”. Club Pueblo),,graphics,,2011,,1959,1981,Spain,1967
Estampa Popular,"Cartel/folleto de la exposición «Estampa Popular». Galería Antonio Machado (Exhibition Poster/Brochure ""Estampa Popular"". Galería Antonio Machado)",,graphics,,2011,,1959,1981,Spain,1972
Estampa Popular,"Cartel de la exposición «Estampa Popular». Ramón Sala de Arte (Exhibition Poster ""Estampa Popular"". Ramón Sala de Arte)",,graphics,,2011,,1959,1981,Spain,1976
Estampa Popular,Cartel de la exposición «Estampa Popular». Casa del Pueblo de Tetuán (Exhibition Poster “Estampa Popular”. Casa del Pueblo de Tetuán),,graphics,,2011,,1959,1981,Spain,1979
Estampa Popular,Cartel de la exposición «Estampa Popular». Sala de Arte de la Casa de Campo (Exhibition Poster “Estampa Popular”. Sala de Arte de la Casa de Campo),,graphics,,2011,,1959,1981,Spain,1981
'Toto' Estirado (José Antonio Estirado),Sin título (Untitled),,graphics,,2011,,1939,1994,Spain,1978
'Toto' Estirado (José Antonio Estirado),The Memorial,,graphics,,2011,,1939,1994,Spain,1978
'Toto' Estirado (José Antonio Estirado),Sin título (Jeroglífico maldito) (Untitled [Cursed Hieroglyph]),,graphics,,2011,,1939,1994,Spain,1978
'Toto' Estirado (José Antonio Estirado),Fe ciega (Blind Faith),,graphics,,2011,,1939,1994,Spain,1978
'Toto' Estirado (José Antonio Estirado),Remolino en el río (Eddy in the River),,graphics,,2011,,1939,1994,Spain,1978
'Toto' Estirado (José Antonio Estirado),Resaca y lluvia (Undercurrent and Rain),,graphics,,2011,,1939,1994,Spain,1978
'Toto' Estirado (José Antonio Estirado),Sin título (A.W. Faber) (Untitled [A.W.Faber]),,graphics,,2011,,1939,1994,Spain,1978
'Toto' Estirado (José Antonio Estirado),Sin título (Jeroglífico) (Untitled [Hieroglyph]),,graphics,,2011,,1939,1994,Spain,1978
'Toto' Estirado (José Antonio Estirado),Caballo galopando en el ocaso (Horse at a Gallop at Sunset),,graphics,,2011,,1939,1994,Spain,1978
Adolfo Estrada,Pintura 0356 (Painting 0356),,painting,,2006,,1942,,Argentina,2003
Alexandre Estrela,Pockets of Silence,,video art,,2018,,1971,,Portugal,2015
Alexandre Estrela,Vidro Duplo (Double Glass),,video art,,2018,,1971,,Portugal,2018
Estrujenbank,Japonízate (Japanese Yourself),,painting,,2009,,1989,1993,Spain,1992
Estrujenbank,"Vista de Carabanchel, Madrid (Carabanchel View, Madrid)",,graphics,,1996,,1989,1993,Spain,1993
Henri Etienne-Martin,Portrait de Claude (Portrait of Claudia),,sculpture,,1988,,,,,1949
Jon Mikel Euba,Sin título (Untitled),,graphics,,2015,,1967,,Spain,2004
Jon Mikel Euba,Sin título (Untitled),,graphics,,2015,,1967,,Spain,2004
Jon Mikel Euba,Sin título (Untitled),,graphics,,2015,,1967,,Spain,2004
Jon Mikel Euba,One and Three Boxes,,installation,,2008,,1967,,Spain,2008
Jon Mikel Euba,VLZQZ volumen 1 en dos / volumen 2 en cuatro (VLZQZ Volume 1 in Two / Volume 2 in Four),,graphics,,2015,,1967,,Spain,2008
Jon Mikel Euba,Aproximación Utrecht (Approximation Utrecht),,graphics,,2008,,1967,,Spain,2008
Jon Mikel Euba,Velázquez,,graphics,,2008,,1967,,Spain,2008
Jon Mikel Euba,VLZQZ volumen 6 en cuatro (VLZQZ volume 6 in Four),,graphics,,2015,,1967,,Spain,2008
Jon Mikel Euba,Breda IV en dos (Dos líneas de desarrollo divergentes) (Breda IV in Two [Two Lines of Divergent Development]),,graphics,,2015,,1967,,Spain,2008
Frederick Henry Evans,Ely Cathedral: A Memory of the Normans,,photography,,2005,,1853,1943,,1899
Frederick Henry Evans,Ely Cathedral: Across Nave and Octagon,,photography,,2005,,1853,1943,,1899
Frederick Henry Evans,York Minster: “In Sure and Certain Hope”,,photography,,2005,,1853,1943,,1900
Frederick Henry Evans,Height and Light in Bourges Cathedral,,photography,,2005,,1853,1943,,1903
Walker Evans,Untitled (Industrial Architecture),,photography,,2014,,1903,1975,United States,1929
Walker Evans,New York State Farm Interior,,photography,,2003,,1903,1975,United States,1931
Walker Evans,"Shoe Sign Stand, Mississippi",,photography,,2014,,1903,1975,United States,1935
Walker Evans,"Untitled (Independence Day, Terra Alta, West Virginia)",,photography,,2014,,1903,1975,United States,1935
Walker Evans,"Untitled (Sidewalk in Vicksburg, Mississippi)",,photography,,2014,,1903,1975,United States,1936
Walker Evans,"Untitled (Men Seated in Front of Coca-Cola Sign, Mississippi)",,photography,,2014,,1903,1975,United States,1936
Walker Evans,Portrait of James Agee,,photography,,2003,,1903,1975,United States,1937
Walker Evans,"Untitled (Subway Passengers, New York)",,photography,,2014,,1903,1975,United States,1938
Walker Evans,"Untitled (Subway Passengers, New York)",,photography,,2014,,1903,1975,United States,1938
Walker Evans,"Untitled (Subway Passengers, New York)",,photography,,2014,,1903,1975,United States,1938
Walker Evans,"Untitled (Subway Passengers, New York)",,photography,,2014,,1903,1975,United States,1938
Walker Evans,"Untitled (Bedroom, Biloxi, Mississippi)",,photography,,2014,,1903,1975,United States,1944
Walker Evans,Untitled (Trash Picture),,photography,,2014,,1903,1975,United States,1968
