Artist,Title,Medium,Medium_classified,Acquistion_classified,Year_acquisition,Gender_classified,Artist_birth_year,Artist_death_year,Country_calculated,Date_creation_year
,La hora de los hornos. 1º Parte: Neocolonialismo y violencia (The Hour of the Furnaces. Part #1: Neocolonialism and Violence),,video art,,,,,,,1966
,Des armes pour l’Espagne antifasciste (Weapons for Anti-Fascist Spain),,graphics,,2012,,,,,1937
,La torre de los siete jorobados (The Tower of the Seven Hunchbacks),,video art,,,,,,,1944
,Sans titre (Paris: boulevard de la Gare) (Untitled [Paris: boulevard de la Gare]),,painting,,2015,,,,,1956
,Agrafage (Stapling),,painting,,2015,,,,,1961
,Principle of Detachment: New York Reading,,sculpture,,2011,,,,,1972
APA (Feliu Elias i Bracons),Concours Préparatoires... Exposition Internationale de la Technique du Bâtiment... Parc de Montjuich (Preparatory Competitions… The International Exhibition of Construction Technology... Montjuic Park),,graphics,,2019,,1878,1948,Spain,1923
Antoni Abad,Sísifo (Sisyphus),,video art,,1998,,1956,,Spain,1995
Francesc Abad,Accions. Treball sobre els quatre elements 1 (Actions. Work on the Four Elements 1),,video art,,2009,,1944,,Spain,1972
Francesc Abad,Accions. Treball sobre els quatre elements 2 (Actions. Work on the Four Elements 2),,video art,,2009,,1944,,Spain,1972
Francesc Abad,"Aire. Acción, cuadrado en el suelo con hojas y destrucción de ese cuadrado por la acción del viento (Air. Action, Square on the Ground with Leaves and Destruction of the Square Due to the Action of the Wind)",,photography,,2009,,1944,,Spain,1972
Francesc Abad,Procés transformació (Transformation Process),,photography,,2009,,1944,,Spain,1972
Francesc Abad,"Peça-forma. Tint-1, Banyoles (Piece-Form. Tint-1, Banyoles)",,video art,,2009,,1944,,Spain,1973
Francesc Abad,Peça-acció 1. Institut industrial de Terrassa (Piece-Action 1. Industrial Institute of Terrassa),,video art,,2009,,1944,,Spain,1973
Francesc Abad,Peça-acció 2. Institut industrial de Terrassa (Piece-Action 2. Industrial Institute of Terrassa),,video art,,2009,,1944,,Spain,1973
Francesc Abad,Terrassa. Informació d'Art (Terrassa. Information of Art),,video art,,2009,,1944,,Spain,1973
Francesc Abad,Medició circular (Roundness Measuring),,video art,,2009,,1944,,Spain,1973
Francesc Abad,Homenatge a l'home del carrer (Homage to the Man in the Street),,installation,,2012,,1944,,Spain,1976
Magdalena Abakanowicz,Thirty Backwards Standing Figures,,sculpture,,1997,,1930,2017,Poland,1993
Ignasi Aballí,Mirades (Gazes),,installation,,2016,,1958,,Spain,1994
Ignasi Aballí,Biblioteca II (Library II),,photography,,2002,,1958,,Spain,2002
Ignasi Aballí,Inmigrantes II (Inmigrants II),,graphics,,2007,,1958,,Spain,2007
Ignasi Aballí,Sin papeles (Undocumented),,graphics,,2007,,1958,,Spain,2007
Ignasi Aballí,Personas IV (People IV),,graphics,,2007,,1958,,Spain,2007
Ignasi Aballí,Viviendas I (Housing I),,graphics,,2007,,1958,,Spain,2007
Ignasi Aballí,Reflexión (Passion),,video art,,2009,,1958,,Spain,2009
Ignasi Aballí,Reflexion (2008) (Reflection [2008]),,video art,,2009,,1958,,Spain,2009
Ignasi Aballí,Les meves mans després de tocar coses brutes (My Hands after Holding Dirty Things),,photography,,2016,,1958,,Spain,2015
Berenice Abbott,Empire State Building,,photography,,2003,,1898,1991,United States,1930
Berenice Abbott,New York by Night,,photography,,2003,,1898,1991,United States,1932
Livio Abramo,Operário e máquinas (Worker and Machines),,graphics,,2017,,1903,1992,Paraguay,1927
Livio Abramo,"Ilustración para el periódico «Lo Spaghetto» (Illustration for the Newspaper ""Lo Spaghetto"")",,graphics,,2017,,1903,1992,Paraguay,1931
Livio Abramo,"Ilustración para el periódico «Lo Spaghetto» (Illustration for the Newspaper ""Lo Spaghetto"")",,graphics,,2017,,1903,1992,Paraguay,1931
Livio Abramo,"Ilustración para el periódico «Lo Spaghetto» (Illustration for the Newspaper ""Lo Spaghetto"")",,graphics,,2017,,1903,1992,Paraguay,1931
Livio Abramo,Vila operária (Working Town),,graphics,,2017,,1903,1992,Paraguay,1935
Livio Abramo,Operário (Worker),,graphics,,2017,,1903,1992,Paraguay,1935
Livio Abramo,Meninas de fábrica (Factory Girls),,graphics,,2017,,1903,1992,Paraguay,1935
Livio Abramo,Espanha (Spain),,graphics,,2017,,1903,1992,Paraguay,1936
Livio Abramo,España (Spain),,graphics,,2017,,1903,1992,Paraguay,1936
Livio Abramo,Miliciano-España (Militiaman-Spain),,graphics,,2017,,1903,1992,Paraguay,1938
Livio Abramo,Itapecerica,,graphics,,2017,,1903,1992,Paraguay,1940
Livio Abramo,Mulheres Itapecerica (Itapecerica Women),,graphics,,2017,,1903,1992,Paraguay,1940
Livio Abramo,Rio,,graphics,,2017,,1903,1992,Paraguay,1951
Livio Abramo,España Vieja Castilla (Old Castile Spain),,graphics,,2017,,1903,1992,Paraguay,1953
Livio Abramo,Macumba,,graphics,,2017,,1903,1992,Paraguay,1957
Livio Abramo,Paraguay-Las ciudades perdidas (Paraguay-The Lost Cities),,graphics,,2017,,1903,1992,Paraguay,1964
Marina Abramovic,AAA-AAA,,installation,,2007,,1946,,Serbia,1978
Marina Abramovic,AAA-AAA,,video art,,2008,,1946,,Serbia,1978
Marina Abramovic,Count on Us,,installation,,2006,,1946,,Serbia,2003
Vito Acconci,"Three Frame Studies (Circle, Jumps, Push: Breakthrough)",,video art,,2010,,1940,2017,United States,1969
Vito Acconci,"Three Relationship Studies (Manipulations, Imitations, Shadow Play)",,video art,,2005,,1940,2017,United States,1970
Vito Acconci,"Three Adaptation Studies (Blindfolded Catching, Soap and Eyes, Hand and Mouth)",,video art,,2007,,1940,2017,United States,1970
Vito Acconci,Centers,,video art,,2007,,1940,2017,United States,1971
Vito Acconci,Remote Control,,video art,,2011,,1940,2017,United States,1971
Vito Acconci,Recording Studio from Air Time,,video art,,2005,,1940,2017,United States,1973
Gabriel Acevedo Velarde,Ciudadano paranormal (Paranormal Citizen),,video art,,2014,,1976,,Peru,2013
Gabriel Acevedo Velarde,Cliente secreto (Secret Client),,video art,,2014,,1976,,Peru,2013
Luis Acosta Moro,Cabeza de muñeca (Doll's Head),,photography,,2014,,1941,2014,Spain,1967
Robert Adams,"Colorado Springs, Colorado",,photography,,2011,,1937,,United States,1968
Robert Adams,"Grazing Land with Pines, near Falcon, Colorado",,photography,,2011,,1937,,United States,1968
Robert Adams,"Outdoor Theater and Cheyenne Mountain, Colorado Springs, Colorado",,photography,,2011,,1937,,United States,1968
Robert Adams,"Colorado Springs, Colorado",,photography,,2011,,1937,,United States,1969
Robert Adams,"Sheridan Boulevard, Lakewood",,photography,,2011,,1937,,United States,1970
Robert Adams,"Denver, Colorado",,photography,,2011,,1937,,United States,1970
Robert Adams,"Northglenn, Colorado",,photography,,2011,,1937,,United States,1973
Robert Adams,"Lakewood, Colorado",,photography,,2011,,1937,,United States,1973
Elías Adasme,A Chile (To Chile),,photography,,2013,,1955,,,1979
Pic Adrian,Composición (Composition),,painting,,1988,,1910,2008,Spain,1964
Eva Aggerholm,Cabeza de muchacha (Head of a Young Woman),,sculpture,,2017,,1879,1959,Spain,1929
Eva Aggerholm,Desnudo (Nude),,sculpture,,2017,,1879,1959,Spain,1940
Agrupación de Plásticos Jóvenes,Libertad (Freedom),,graphics,,2018,,1979,1987,,1980
Agrupación de Plásticos Jóvenes,Víctor Jara,,graphics,,2018,,1979,1987,,1981
Agrupación de Plásticos Jóvenes,Violeta,,graphics,,2018,,1979,1987,,1982
Agrupación de Plásticos Jóvenes,Derecho a la vida (Right to Life),,graphics,,2018,,1979,1987,,1982
Agrupación de Plásticos Jóvenes,"Stgo., Chile",,graphics,,2018,,1979,1987,,1982
Agrupación de Plásticos Jóvenes,Tatiana Fariña,,graphics,,2018,,1979,1987,,1985
Agrupación de Plásticos Jóvenes,Justicia!! (Justice!!),,graphics,,2018,,1979,1987,,1985
Agrupación de Plásticos Jóvenes,Libertad para Gonzalo (Freedom for Gonzalo),,graphics,,2018,,1979,1987,,1986
Agrupación de Plásticos Jóvenes,"Imagen de Cristo, paco y gorila (Image of Christ, Cop and Gorilla)",,graphics,,2018,,1979,1987,,1987
Fermín Aguayo,Animales sumergidos (Submerged Animals),,graphics,,2019,,1926,1977,,1948
Fermín Aguayo,Sordina (Damper),,painting,,2000,,1926,1977,,1949
Fermín Aguayo,Enero (January),,painting,,2000,,1926,1977,,1949
Fermín Aguayo,Aurora (Dawn),,painting,,2000,,1926,1977,,1950
Fermín Aguayo,Collioure,,painting,,2002,,1926,1977,,1958
Fermín Aguayo,Paysage aux peupliers (Landscape with Poplars),,painting,,1988,,1926,1977,,1960
Fermín Aguayo,Altos cipreses (High Cypresses),,painting,,2000,,1926,1977,,1960
Fermín Aguayo,Le Pont (The Bridge),,painting,,2004,,1926,1977,,1972
Cristóbal Aguilar,Sin título (Untitled),,graphics,,2010,,1939,2019,Spain,1961
Cristóbal Aguilar,Sin título (Untitled),,graphics,,2010,,1939,2019,Spain,1961
Sergi Aguilar,Sin título (Untitled),,graphics,,1988,,1946,,Spain,1969
Sergi Aguilar,Sin título (Untitled),,graphics,,1988,,1946,,Spain,1969
Sergi Aguilar,Sin título (Untitled),,graphics,,1988,,1946,,Spain,1969
Sergi Aguilar,Sin título (Untitled),,graphics,,1988,,1946,,Spain,1969
Sergi Aguilar,Sin título (Untitled),,graphics,,1988,,1946,,Spain,1969
Sergi Aguilar,Sin título (Untitled),,graphics,,1988,,1946,,Spain,1969
Sergi Aguilar,Mirada (Gaze),,sculpture,,1988,,1946,,Spain,1987
Sergi Aguilar,Octubre (October),,sculpture,,1988,,1946,,Spain,1987
Sergi Aguilar,Trans (Rojo) (Trans [Red]),,graphics,,1997,,1946,,Spain,1994
Sergi Aguilar,Pic - o - Walk,,graphics,,1997,,1946,,Spain,1994
Lorenzo Victoriano Aguirre Sánchez,Luz divina (Divine Light),,painting,,1988,,1885,1942,Spain,1922
Javier Aguirre,Uts cero,,video art,,2008,,1935,,Spain,1967
Javier Aguirre,"Che, Che, Che",,video art,,2008,,1935,,Spain,1967
Javier Aguirre,Fluctuaciones entrópicas (Entropic Fluctuations),,video art,,2008,,1935,,Spain,1968
Javier Aguirre,Objetivo 40º (40 Degree Lens),,video art,,2008,,1935,,Spain,1968
Javier Aguirre,Espectro siete (Espectre Seven),,video art,,2008,,1935,,Spain,1969
Javier Aguirre,Innerzeitigkeit (Temporalidad interna) (Innerzeitigkeit [Internal Temporality]),,video art,,2008,,1935,,Spain,1969
Javier Aguirre,Múltiples. Número indeterminado (Multiples. Unknown Number),,video art,,2008,,1935,,Spain,1970
Javier Aguirre,Impulsos ópticos en progresión geométrica (Optical Impulses in Geometric Progression),,video art,,2008,,1935,,Spain,1970
Juan Antonio Aguirre,"Tarde en Flamengo, Río de Janeiro (Afternoon in Flamengo, Rio de Janeiro)",,painting,,2007,,1945,,Spain,1980
Agustín Parejo School,Caucus,,video art,,2013,,1982,1994,Spain,1986
Agustín Parejo School,Picasso par Picabia (Picasso by Picabia),,video art,,2013,,1982,1994,Spain,1986
Agustín Parejo School,Málaga Euskadi da,,video art,,2013,,1982,1994,Spain,1986
Agustín Parejo School,Sábana Santa (The Holy Shroud),,object,,2014,,1982,1994,Spain,1990
Agustín Parejo School,Dame algo (Give me Something),,sculpture,,2014,,1982,1994,Spain,1991
Pep Agut,Rescue attemp. Nonsense (Attempt at Salvation. Absurd),,sculpture,,2012,,1961,,Spain,1994
Pep Agut,Distancia Zero (Zero Distance),,sculpture,,2012,,1961,,Spain,1994
Pep Agut,Hèrcules (Autoretrat en devaluació econòmica i plusvàlua cultural) (Hercules [Self-Portrait in Economic Devaluation and Cultural Capital Gain]),,graphics,,2008,,1961,,Spain,2008
Ana Laura Aláez,Superwoman,,sculpture,,2019,,1964,,Spain,1993
Ana Laura Aláez,Sade,,photography,,2000,,1964,,Spain,1999
Ana Laura Aláez,Dance & Disco #1,,video art,,2000,,1964,,Spain,2000
Ana Laura Aláez,Dance & Disco #2,,video art,,2000,,1964,,Spain,2000
Ana Laura Aláez,Dance & Disco #3,,video art,,2000,,1964,,Spain,2000
Ana Laura Aláez,Creative Powders,,photography,,2001,,1964,,Spain,2001
Ana Laura Aláez,La bestia (The Beast),,sculpture,,2015,,1964,,Spain,2009
Ana Laura Aláez,Aullido (se mata lo que se ama) (Howl [Killing What Is Loved]),,sculpture,,2015,,1964,,Spain,2009
Ana Laura Aláez,Miel-Nube-Hiel (Lady) (Honey-Cloud-Bile [Lady]),,photography,,2015,,1964,,Spain,2009
Enrique Alarcón,El caso de la mujer asesinadita (The Case of the Slightly Murdered Woman),,graphics,,2014,,1917,1995,Spain,1946
Alfonso Albacete,Tercera pérgola (Third Pergola),,painting,,1988,,1950,,Spain,1980
Alfonso Albacete,Dos calles conducen al Sur (Two Streets Leading to the South),,painting,,2002,,1950,,Spain,1986
Alfonso Albacete,Después de la tormenta (Mirando a poniente) (After the Storm [Watching the Setting Sun]),,painting,,2001,,1950,,Spain,1986
Alfonso Albacete,Jacob 12,,painting,,2001,,1950,,Spain,1999
Rafael Alberti,Sin título (La barca blanca) (Untitled [The White Boat]),,graphics,,2001,,1902,1999,Spain,1920
Rafael Alberti,Sin título (Poniente) (Untitled [West]),,graphics,,2001,,1902,1999,Spain,1920
Rafael Alberti,Sin título (Un sol de agrias notas) (Untitled [A Sun of Sour Notes]),,graphics,,2001,,1902,1999,Spain,1920
Rafael Alberti,Composición (Composition),,graphics,,2000,,1902,1999,Spain,1921
Rafael Alberti,Marinero en tierra (Sailor on Land),,graphics,,1999,,1902,1999,Spain,1925
Rafael Alberti,Joselito en su gloria (Joselito in his Glory),,graphics,,2002,,1902,1999,Spain,1949
Alberto (Alberto Sánchez),El ciego de la bandurria (Blind Man with Bandurria),,sculpture,,2000,,1895,1962,United States,1923
Alberto (Alberto Sánchez),Carretero vasco (Basque Labourer),,sculpture,,2000,,1895,1962,United States,1923
Alberto (Alberto Sánchez),Campesina (Peasant Woman),,sculpture,,1989,,1895,1962,United States,1923
Alberto (Alberto Sánchez),Café de Atocha (Café in Atocha),,graphics,,2000,,1895,1962,United States,1924
Alberto (Alberto Sánchez),Alegoría del toro y el torero (Allegory for the Bull and the Bullfighter),,graphics,,1998,,1895,1962,United States,1926
Alberto (Alberto Sánchez),Mascarilla de la mula (The Mule's Mask),,graphics,,1998,,1895,1962,United States,1926
Alberto (Alberto Sánchez),La profanación de la fe (Profanation of the Faith),,graphics,,1998,,1895,1962,United States,1926
Alberto (Alberto Sánchez),Bailarina (Dancer),,sculpture,,1991,,1895,1962,United States,1927
Alberto (Alberto Sánchez),Cabeza de Góngora (Góngora's Head),,sculpture,,1991,,1895,1962,United States,1927
Alberto (Alberto Sánchez),Bailarina (Dancer),,sculpture,,1989,,1895,1962,United States,1927
Alberto (Alberto Sánchez),Recuerdo de Melilla (Memory of Melilla),,graphics,,1998,,1895,1962,United States,1929
Alberto (Alberto Sánchez),Maternidad (Maternity),,sculpture,,1988,,1895,1962,United States,1930
Alberto (Alberto Sánchez),Maternidad (Maternity),,sculpture,,1988,,1895,1962,United States,1930
Alberto (Alberto Sánchez),Monumento a los pájaros (fragmento) (Monument to the Birds [Fragment]),,sculpture,,1991,,1895,1962,United States,1930
Alberto (Alberto Sánchez),"Boceto para el decorado central de «Fuenteovejuna» (Sketch for Central Set of ""Fuenteovejuna"")",,graphics,,2002,,1895,1962,United States,1932
Alberto (Alberto Sánchez),"Boceto para el decorado lateral de «Fuenteovejuna» (Sketch for Lateral Set of ""Fuenteovejuna"")",,graphics,,2002,,1895,1962,United States,1932
Alberto (Alberto Sánchez),"Boceto para el decorado lateral de «Fuenteovejuna» (Sketch for Lateral Set of ""Fuenteovejuna"")",,graphics,,2002,,1895,1962,United States,1932
Alberto (Alberto Sánchez),"Macho-hembra. Boceto para el telón lateral derecho del ballet «La romería de los cornudos» (Male-Female. Sketch for the right side courtain of the ballet ""The Pilgrimage of Cuckolds"")",,graphics,,2002,,1895,1962,United States,1933
Alberto (Alberto Sánchez),La romería de los cornudos (The Pilgrimage of Cuckolds),,painting,,2001,,1895,1962,United States,1933
Alberto (Alberto Sánchez),Benimámet,,graphics,,1988,,1895,1962,United States,1937
Alberto (Alberto Sánchez),El pueblo español tiene un camino que conduce a una estrella (maqueta) (The Spanish People Have a Path that Leads to a Star [Maquette]),,sculpture,,2008,,1895,1962,United States,1937
Alberto (Alberto Sánchez),El pueblo español tiene un camino que conduce a una estrella (maqueta) (The Spanish People Have a Path that Leads to a Star [Maquette]),,sculpture,,1991,,1895,1962,United States,1937
Alberto (Alberto Sánchez),El Quijote: pueblo de La Mancha (El Quijote: Town in La Mancha),,graphics,,1988,,1895,1962,United States,1955
Alberto (Alberto Sánchez),Escultura rural toledana (Sculpture for Rural Area of Toledo),,graphics,,2000,,1895,1962,United States,1956
Alberto (Alberto Sánchez),Minerva de los Andes (Minerva of the Andes),,sculpture,,1988,,1895,1962,United States,1956
Alberto (Alberto Sánchez),Árboles que parecéis (Trees That You Are Like),,graphics,,1991,,1895,1962,United States,1956
Alberto (Alberto Sánchez),"Boceto para «La fuente del festival» (Sketch for ""The Festival Fountain"")",,graphics,,2000,,1895,1962,United States,1957
Alberto (Alberto Sánchez),Perdiz del Cáucaso (Partridge from the Caucasus),,sculpture,,1988,,1895,1962,United States,1957
Alberto (Alberto Sánchez),Poste de señales del río Belaya (Signal Post at Belaya River),,sculpture,,1991,,1895,1962,United States,1957
Alberto (Alberto Sánchez),Apunte de escultura para un puerto (Note on a Sculpture for a Port),,graphics,,2000,,1895,1962,United States,1958
Alberto (Alberto Sánchez),La dama del pan de Riga (The Lady of the Bread in Riga),,graphics,,2006,,1895,1962,United States,1958
Alberto (Alberto Sánchez),La dama del pan de Riga (The Lady of Bread in Riga),,sculpture,,2006,,1895,1962,United States,1958
Alberto (Alberto Sánchez),Toro (Bull),,sculpture,,1988,,1895,1962,United States,1958
Alberto (Alberto Sánchez),Torero (Bullfighter),,sculpture,,1988,,1895,1962,United States,1958
Alberto (Alberto Sánchez),Reclamo de alondras (Skylark Lure),,sculpture,,1991,,1895,1962,United States,1958
Alberto (Alberto Sánchez),Máscara (Mask),,sculpture,,2005,,1895,1962,United States,1960
Alberto (Alberto Sánchez),Casa del pájaro ruso (The Russian Bird's House),,sculpture,,1988,,1895,1962,United States,1960
Alberto (Alberto Sánchez),El gallo y la gallina (The Rooster and the Hen),,sculpture,,1988,,1895,1962,United States,1960
José Antonio Alcácer Garmendia,Represión (Repression),,graphics,,2010,,1939,2018,Spain,1964
José Antonio Alcácer Garmendia,El cartel del crimen (Crime Cartel),,graphics,,2010,,1939,2018,Spain,1964
Carlos Alcolea,Schreber también escribe (Schreber Also Writes),,painting,,2002,,1949,1992,Spain,1976
Carlos Alcolea,"Matisse de día, Matisse de noche (Matisse by Day, Matisse by Night)",,painting,,1988,,1949,1992,Spain,1977
Carlos Alcolea,Finisterre (Fisterra),,painting,,2013,,1949,1992,Spain,1988
Eduardo Alcoy Lázaro,Pintura 59-70 (Painting 59-70),,painting,,1988,,1930,1987,Spain,1959
Pierre Alechinsky,Les hautes herbes (The High Grass),,painting,,1997,,1927,,Belgium,1951
José Luis Alexanco,Doble postura para hombre que corre (Double Position for a Man Running),,painting,,2008,,1942,2021,Spain,1967
José Luis Alexanco,Programa MOUVNT (Computer Program MOUVNT),,new media,,2008,,1942,2021,Spain,1969
José Luis Alexanco,Soledad interrumpida (Interrupted Solitude),,graphics,,2008,,1942,2021,Spain,1970
José Luis Alexanco,Buenos Aires,,graphics,,2008,,1942,2021,Spain,1971
José Luis Alexanco,Palacio de Cristal II (Crystal Palace II),,graphics,,2008,,1942,2021,Spain,1971
José Luis Alexanco,Palacio de Cristal I (Crystal Palace I),,graphics,,2008,,1942,2021,Spain,1971
José Luis Alexanco,Soledad interrumpida (Interrupted Solitude),,installation,,2009,,1942,2021,Spain,1971
José Luis Alexanco,138 (Historia natural) (138 [Natural History]),,video art,,2008,,1942,2021,Spain,1972
José Luis Alexanco,Sablonceaux II,,graphics,,2008,,1942,2021,Spain,1972
José Luis Alexanco,Historia Natural III (Natural History III),,graphics,,2008,,1942,2021,Spain,1972
José Luis Alexanco,Historia Natural II (Natural History II),,graphics,,2008,,1942,2021,Spain,1972
José Luis Alexanco,Historia Natural IV (Natural History IV),,graphics,,2008,,1942,2021,Spain,1972
José Luis Alexanco,Historia Natural I (Natural History I),,graphics,,2008,,1942,2021,Spain,1972
José Luis Alexanco,Historia Natural V (Natural History V),,graphics,,2008,,1942,2021,Spain,1972
José Luis Alexanco,Paris ARC I,,graphics,,2008,,1942,2021,Spain,1972
José Luis Alexanco,Paris ARC II,,graphics,,2008,,1942,2021,Spain,1972
José Luis Alexanco,Escultura MOUVNT (MOUVNT Sculpture),,sculpture,,2009,,1942,2021,Spain,1972
José Luis Alexanco,Escultura MOUVNT (MOUVNT Sculpture),,sculpture,,2009,,1942,2021,Spain,1972
José Luis Alexanco,Escultura MOUVNT (MOUVNT Sculpture),,sculpture,,2009,,1942,2021,Spain,1972
José Luis Alexanco,Escultura MOUVNT (MOUVNT Sculpture),,sculpture,,2009,,1942,2021,Spain,1972
José Luis Alexanco,Sablonceaux IV,,graphics,,2008,,1942,2021,Spain,1973
José Luis Alexanco,Sablonceaux III,,graphics,,2008,,1942,2021,Spain,1973
José Luis Alexanco,Munich,,graphics,,2008,,1942,2021,Spain,1973
José Luis Alexanco,Sablonceaux I,,graphics,,2008,,1942,2021,Spain,1973
José Luis Alexanco,Sablonceaux V,,graphics,,2008,,1942,2021,Spain,1973
José Luis Alexanco,Sablonceaux VII,,graphics,,2008,,1942,2021,Spain,1973
José Luis Alexanco,Sablonceaux VIII,,graphics,,2008,,1942,2021,Spain,1973
José Luis Alexanco,Sablonceaux II,,graphics,,2008,,1942,2021,Spain,1973
José Luis Alexanco,Escultura MOUVNT (MOUVNT Sculpture),,sculpture,,2009,,1942,2021,Spain,1974
José Luis Alexanco,Escultura MOUVNT (MOUVNT Sculpture),,sculpture,,2009,,1942,2021,Spain,1974
José Luis Alexanco,Escultura MOUVNT (MOUVNT Sculpture),,sculpture,,2009,,1942,2021,Spain,1974
José Luis Alexanco,S. I. Université de Montréal (S.I. University of Montreal),,graphics,,2008,,1942,2021,Spain,1975
José Luis Alexanco,S. I. Université d'Ottawa (I. S. University of Ottawa),,graphics,,2008,,1942,2021,Spain,1975
José Luis Alexanco,Ingerencia informal (Informal Interference),,graphics,,2020,,1942,2021,Spain,1975
José Luis Alexanco,The Kitchen III,,graphics,,2008,,1942,2021,Spain,1980
José Luis Alexanco,The Kitchen I,,graphics,,2008,,1942,2021,Spain,1980
José Luis Alexanco,The Kitchen IV,,graphics,,2008,,1942,2021,Spain,1980
José Luis Alexanco,The Kitchen II,,graphics,,2008,,1942,2021,Spain,1980
José Luis Alexanco,Por diversos motivos 2 (For Various Reasons 2),,graphics,,2008,,1942,2021,Spain,1982
José Luis Alexanco,Por diversos motivos 1 (For Various Reasons 1),,graphics,,2008,,1942,2021,Spain,1982
Elvira Alfageme Esteban,Planos y líneas (Planes and Lines),,sculpture,,1988,,1937,,Spain,1966
Elvira Alfageme Esteban,Yunque (Anvil),,sculpture,,1988,,1937,,Spain,1966
Elvira Alfageme Esteban,Torre espacial (Spatial Tower),,sculpture,,1988,,1937,,Spain,1969
Andreu Alfaro,Filferro i llauna IV (b) (Wire and Tin IV [b]),,sculpture,,1997,,1929,2012,Spain,1958
Andreu Alfaro,Homenaje a Picasso (Homage to Picasso),,sculpture,,1988,,1929,2012,Spain,1967
Andreu Alfaro,Any 1968. Estampa Popular de València (Year 1968. Estampa Popular de Valencia),,graphics,,2010,,1929,2012,Spain,1967
Andreu Alfaro,No Title,,sculpture,,1997,,1929,2012,Spain,1987
Andreu Alfaro,No Title,,sculpture,,1997,,1929,2012,Spain,1987
Andreu Alfaro,Mujer tumbada (Lying Woman),,sculpture,,1989,,1929,2012,Spain,1988
Carlos Washington Aliseris Genta,Valle de Aiguá (Valley of Aiguá),,painting,,1988,,1898,1974,Uruguay,1936
Lara Almarcegui,"Explorando el suelo, Sala Moncada, Barcelona (Exploring the Floor, Sala Moncada, Barcelona )",,photography,,2012,,1972,,Spain,2003
Helena Almeida,Desenho habitado (Inhabited Drawing),,photography,,2010,,1934,2018,Portugal,1975
Helena Almeida,Desenho habitado (Inhabited Drawing),,photography,,2010,,1934,2018,Portugal,1975
Helena Almeida,Desenho habitado (Inhabited Drawing),,photography,,2010,,1934,2018,Portugal,1975
Helena Almeida,Sem titulo (Untitled),,photography,,1997,,1934,2018,Portugal,1996
Fernando Almela,Romance de ciego (Blind Romance),,painting,,2014,,1943,2009,Spain,1974
Fernando Almela,Espejo de Anita (Anita's Mirror),,painting,,2014,,1943,2009,Spain,1974
Pedro Almodóvar,PA SOL INI,,graphics,,2015,,1949,,Spain,1975
Max Almy,The Perfect Leader,,video art,,2006,,1948,,United States,1983
Josep Alumà i Sans,No Title,,photography,,2011,,1897,1974,Spain,1930
Darío Álvarez Basso,La Casa dei Cervi (The House of the Deers),,painting,,1998,,1966,,Venezuela,1990
Manuel Álvarez Bravo,"Manuel Álvarez Bravo, Fotografías (Manuel Álvarez Bravo, Photographs)",,photography,,2015,,1902,2002,Mexico,1945
Manuel Álvarez Bravo,Autorretrato (Self-Portrait),,photography,,1997,,1902,2002,Mexico,1980
Efrén Álvarez,Democratic Centralism,,graphics,,2019,,1980,,Spain,2009
Efrén Álvarez,Vanguardias históricas (Historical Avant-Gardes),,graphics,,2019,,1980,,Spain,2009
Efrén Álvarez,Flujo circular del dinero. Distinción entre casas (Circular Flow of Money. Distinction Between Houses),,graphics,,2012,,1980,,Spain,2011
Efrén Álvarez,Transacciones de los ricos. La acción (Transactions of the Rich. The Action),,graphics,,2012,,1980,,Spain,2011
Efrén Álvarez,Flujo circular del dinero (Circular Flow of Money),,graphics,,2012,,1980,,Spain,2011
Efrén Álvarez,Flujo circular del dinero. Supervisar (Circular Flow of Money. Supervising),,graphics,,2012,,1980,,Spain,2011
Efrén Álvarez,Flujo circular del dinero. Organizar (Organising. Circular Flow of Money),,graphics,,2012,,1980,,Spain,2011
Efrén Álvarez,Transacciones de los ricos. El inmueble (The Property. Transactions of the Rich),,graphics,,2012,,1980,,Spain,2011
Efrén Álvarez,Flujo circular del dinero (Circular Flow of Money),,graphics,,2012,,1980,,Spain,2011
Efrén Álvarez,Transacciones de los ricos. El negocio (The Business. Transactions of the Rich),,graphics,,2012,,1980,,Spain,2011
Francisco Álvarez,Los abogados del dólar (Lawyers of the Dollar),,graphics,,2011,,1936,,Spain,1960
Francisco Álvarez,Manifestación (Demonstration),,graphics,,2010,,1936,,Spain,1962
Francisco Álvarez,Militares (Soldiers),,graphics,,2010,,1936,,Spain,1962
Francisco Álvarez,Marioneta política (Political Puppet),,graphics,,2010,,1936,,Spain,1964
Francisco Álvarez,La ley del embudo (Funnel Law),,graphics,,2011,,1936,,Spain,1969
